nl,nl type,chart,hardness,table name,database,label,column,aggregate,mark,encoding,sort,filter
How Shop_ID and Employee_ID correlate?,abstract,Scatter,Easy,hiring,employee_hire_evaluation,mark point data hiring encoding x shop_id y aggregate none employee_id,"Shop_ID,Employee_ID",none,point,"x=Shop_ID,y=Employee_ID,color=none",none,none
Compare investor investments.,abstract,Bar,Medium,entrepreneur,entrepreneur,mark bar data entrepreneur encoding x investor y aggregate count investor transform group x ,Investor,count Investor,bar,"x=Investor,y=count Investor,color=none",none,none
Graph of investors and their investments.,abstract,Bar,Easy,entrepreneur,entrepreneur,mark bar data entrepreneur encoding x investor y aggregate count investor transform group x,Investor,count Investor,bar,"x=Investor,y=count Investor,color=none",none,none
Show me a diagram of investments.,abstract,Pie,Easy,entrepreneur,entrepreneur,mark arc data entrepreneur encoding x investor y aggregate count investor transform group x,Investor,count Investor,arc,"x=Investor,y=count Investor,color=none",none,none
How many people live in each city and what's the status?,abstract,Bar,Medium,city,farm,mark bar data city encoding x status y aggregate mean population transform group x ,"Status,Population",mean Population,bar,"x=Status,y=mean Population,color=none",none,none
Graph the city statuses and population.,abstract,Bar,Easy,city,farm,mark bar data city encoding x status y aggregate mean population transform group x,"Status,Population",mean Population,bar,"x=Status,y=mean Population,color=none",none,none
What do the population stats look like?,abstract,Pie,Easy,city,farm,mark arc data city encoding x status y aggregate mean population transform group x,"Status,Population",mean Population,arc,"x=Status,y=mean Population,color=none",none,none
 Can I see a chart of population and statuses?,abstract,Pie,Easy,city,farm,mark arc data city encoding x status y aggregate mean population transform group x,"Status,Population",mean Population,arc,"x=Status,y=mean Population,color=none",none,none
Visualize the estimates for film markets.,abstract,Scatter,Easy,film_market_estimation,film_rank,mark point data film_market_estimation encoding x low_estimate y aggregate none high_estimate,"Low_Estimate,High_Estimate",none,point,"x=Low_Estimate,y=High_Estimate,color=none",none,none
Show me the number of flights to each destination.,abstract,Bar,Medium,Flight,flight_1,mark bar data flight encoding x destination y aggregate count destination transform group x ,destination,count destination,bar,"x=destination,y=count destination,color=none",none,none
How many flights with a price over 300 to each destination?,abstract,Pie,Medium,Flight,flight_1,mark arc data flight encoding x destination y aggregate count destination transform filter price > 300 group x,destination,count destination,arc,"x=destination,y=count destination,color=none",none,price gt 300
Make me a graph of flights with fares higher than 300 by destination.,abstract,Bar,Hard,Flight,flight_1,mark bar data flight encoding x destination y aggregate count destination transform filter price > 300 group x ,destination,count destination,bar,"x=destination,y=count destination,color=none",none,price gt 300
Compare aircraft distances.,abstract,Bar,Easy,Aircraft,flight_1,mark bar data aircraft encoding x name y aggregate none distance,"name,distance",none,bar,"x=name,y=distance,color=none",none,none
Show me the flight count per pilot.,abstract,Pie,Easy,flight,flight_company,mark arc data flight encoding x pilot y aggregate count pilot transform group x,Pilot,count Pilot,arc,"x=Pilot,y=count Pilot,color=none",none,none
Display the ids and locations of circuits in France or Belgium.,abstract,Bar,Medium,circuits,formula_1,"mark bar data circuits encoding x location y aggregate none circuitid transform filter country = ""france"" or country = ""belgium""","location,circuitId",none,bar,"x=location,y=circuitId,color=none",none,"country = ""France"" or country = ""Belgium"""
Show me the ids and locations of circuits in France or Belgium.,abstract,Bar,Hard,circuits,formula_1,"mark bar data circuits encoding x location y aggregate none circuitid transform filter country = ""france"" or country = ""belgium"" ","location,circuitId",none,bar,"x=location,y=circuitId,color=none",none,"country = ""France"" or country = ""Belgium"""
What's the distribution of races from 2009 to 2011?,abstract,Bar,Hard,races,formula_1,mark bar data races encoding x name y aggregate count name transform filter year between 2009 and 2011 group x ,name,count name,bar,"x=name,y=count name,color=none",none,year gte 2009 and year lte 2011
Show me the races from 2009-2011.,abstract,Bar,Medium,races,formula_1,mark bar data races encoding x name y aggregate count name transform filter year between 2009 and 2011 group x,name,count name,bar,"x=name,y=count name,color=none",none,year gte 2009 and year lte 2011
What is the trend of gas station numbers for each manager.,abstract,Bar,Medium,gas_station,gas_company,mark bar data gas_station encoding x manager_name y aggregate count manager_name transform group x ,Manager_Name,count Manager_Name,bar,"x=Manager_Name,y=count Manager_Name,color=none",none,none
What's the distribution of gas stations by manager?,abstract,Bar,Easy,gas_station,gas_company,mark bar data gas_station encoding x manager_name y aggregate count manager_name transform group x,Manager_Name,count Manager_Name,bar,"x=Manager_Name,y=count Manager_Name,color=none",none,none
Visualize a chart of the primary affiliation of physicians and departments,abstract,Scatter,Easy,affiliated_with,hospital_1,mark point data affiliated_with encoding x physician y aggregate none department transform filter primaryaffiliation = 1,"Physician,Department",none,point,"x=Physician,y=Department,color=none",none,PrimaryAffiliation = 1
Can you draw a chart illustrating the different state provinces and the count?,abstract,Bar,Easy,locations,hr_1,mark bar data locations encoding x state_province y aggregate count state_province transform group x,STATE_PROVINCE,count STATE_PROVINCE,bar,"x=STATE_PROVINCE,y=count STATE_PROVINCE,color=none",none,none
Can I get a chart of jobs and their salary ranges with a maximum salary between 12000-18000.,abstract,Bar,Medium,jobs,hr_1,mark bar data jobs encoding x job_title y aggregate none max_salary - min_salary transform filter max_salary between 12000 and 18000 ,"JOB_TITLE,MAX_SALARY",none,bar,"x=JOB_TITLE,y=MAX_SALARY - MIN_SALARY,color=none",none,MAX_SALARY gte 12000 and MAX_SALARY lte 18000
 I want to know jobs and salary ranges with max salary in the 12k-18k in a chart,abstract,Pie,Medium,jobs,hr_1,mark arc data jobs encoding x job_title y aggregate none max_salary - min_salary transform filter max_salary between 12000 and 18000,"JOB_TITLE,MAX_SALARY",none,arc,"x=JOB_TITLE,y=MAX_SALARY - MIN_SALARY,color=none",none,MAX_SALARY gte 12000 and MAX_SALARY lte 18000
"Make a graph of the countries, in name descending order",abstract,Bar,Medium,countries,hr_1,mark bar data countries encoding x country_name y aggregate count country_name transform group x sort x desc,COUNTRY_NAME,count COUNTRY_NAME,bar,"x=COUNTRY_NAME,y=count COUNTRY_NAME,color=none",x desc,none
Can I get a visualization of country names,abstract,Bar,Easy,countries,hr_1,mark bar data countries encoding x country_name y aggregate count country_name transform group x,COUNTRY_NAME,count COUNTRY_NAME,bar,"x=COUNTRY_NAME,y=count COUNTRY_NAME,color=none",none,none
What's the ratio of the countries?,abstract,Pie,Easy,countries,hr_1,mark arc data countries encoding x country_name y aggregate count country_name transform group x,COUNTRY_NAME,count COUNTRY_NAME,arc,"x=COUNTRY_NAME,y=count COUNTRY_NAME,color=none",none,none
Sort the rooms by bed type.,abstract,Bar,Medium,Rooms,inn_1,mark bar data rooms encoding x bedtype y aggregate count bedtype transform group x sort x asc,bedType,count bedType,bar,"x=bedType,y=count bedType,color=none",x asc,none
Display the decor frequency of king bed rooms.,abstract,Pie,Medium,Rooms,inn_1,mark arc data rooms encoding x decor y aggregate count decor transform filter bedtype = 'king' group x,decor,count decor,arc,"x=decor,y=count decor,color=none",none,"bedType = ""King"""
How many policies are there for each type?,abstract,Bar,Easy,policies,insurance_and_eClaims,mark bar data policies encoding x policy_type_code y aggregate count policy_type_code transform group x,Policy_Type_Code,count Policy_Type_Code,bar,"x=Policy_Type_Code,y=count Policy_Type_Code,color=none",none,none
 Give me a breakdown of the policies by type.,abstract,Bar,Easy,policies,insurance_and_eClaims,mark bar data policies encoding x policy_type_code y aggregate count policy_type_code transform group x,Policy_Type_Code,count Policy_Type_Code,bar,"x=Policy_Type_Code,y=count Policy_Type_Code,color=none",none,none
What's the breakdown of policies by type code?,abstract,Pie,Easy,policies,insurance_and_eClaims,mark arc data policies encoding x policy_type_code y aggregate count policy_type_code transform group x,Policy_Type_Code,count Policy_Type_Code,arc,"x=Policy_Type_Code,y=count Policy_Type_Code,color=none",none,none
What is the distribution of payment methods?,abstract,Bar,Easy,Payments,insurance_policies,mark bar data payments encoding x payment_method_code y aggregate count payment_method_code transform group x,Payment_Method_Code,count Payment_Method_Code,bar,"x=Payment_Method_Code,y=count Payment_Method_Code,color=none",none,none
Graph the payment amounts proportion per payment method.,abstract,Pie,Easy,Payments,insurance_policies,mark arc data payments encoding x payment_method_code y aggregate sum amount_payment transform group x,"Payment_Method_Code,Amount_Payment",sum Amount_Payment,arc,"x=Payment_Method_Code,y=sum Amount_Payment,color=none",none,none
What's the pattern of avg payments over time?,abstract,Line,Medium,Payments,insurance_policies,mark line data payments encoding x date_payment_made y aggregate mean amount_payment transform group x ,"Date_Payment_Made,Amount_Payment",mean Amount_Payment,line,"x=Date_Payment_Made,y=mean Amount_Payment,color=none",none,none
Can I get a chart of Visa payments?,abstract,Scatter,Easy,Payments,insurance_policies,mark point data payments encoding x payment_id y aggregate none amount_payment transform filter payment_method_code = 'visa',"Payment_ID,Amount_Payment",none,point,"x=Payment_ID,y=Amount_Payment,color=none",none,Payment_Method_Code = 'Visa'
How has the frequency of the claim dates changed?,abstract,Line,Medium,Settlements,insurance_policies,mark line data settlements encoding x date_claim_settled y aggregate count date_claim_settled transform group x ,Date_Claim_Settled,count Date_Claim_Settled,line,"x=Date_Claim_Settled,y=count Date_Claim_Settled,color=none",none,none
"Graph the name attribute, from low to high",abstract,Bar,Medium,editor,journal_committee,mark bar data editor encoding x name y aggregate count name transform group x sort y asc,Name,count Name,bar,"x=Name,y=count Name,color=none",y asc,none
Visualize the amount of names. ,abstract,Bar,Easy,editor,journal_committee,mark bar data editor encoding x name y aggregate count name transform group x,Name,count Name,bar,"x=Name,y=count Name,color=none",none,none
What's the average account balance of customers with credit score under 50 by type of account?,abstract,Pie,Medium,customer,loan_1,mark arc data customer encoding x acc_type y aggregate mean acc_bal transform filter credit_score < 50 group x,"acc_type,acc_bal",mean acc_bal,arc,"x=acc_type,y=mean acc_bal,color=none",none,credit_score lt 50
How many items are there based on type of thing? In asc order,abstract,Bar,Medium,Things,local_govt_and_lot,mark bar data things encoding x type_of_thing_code y aggregate count type_of_thing_code transform group x sort y asc,Type_of_Thing_Code,count Type_of_Thing_Code,bar,"x=Type_of_Thing_Code,y=count Type_of_Thing_Code,color=none",y asc,none
Chart the count of each type of thing.,abstract,Bar,Easy,Things,local_govt_and_lot,mark bar data things encoding x type_of_thing_code y aggregate count type_of_thing_code transform group x,Type_of_Thing_Code,count Type_of_Thing_Code,bar,"x=Type_of_Thing_Code,y=count Type_of_Thing_Code,color=none",none,none
Show me a chart of resident details.,abstract,Bar,Easy,Residents,local_govt_and_lot,mark bar data residents encoding x other_details y aggregate none resident_id,"other_details,resident_id",none,bar,"x=other_details,y=resident_id,color=none",none,none
Show me the events and their properties.,abstract,Scatter,Easy,customer_events,local_govt_and_lot,mark point data customer_events encoding x customer_event_id y aggregate none property_id,"Customer_Event_ID,property_id",none,point,"x=Customer_Event_ID,y=property_id,color=none",none,none
Make a chart showing the participant info with ids in asc order,abstract,Bar,Easy,Participants,local_govt_in_alabama,mark bar data participants encoding x participant_details y aggregate none participant_id transform sort x asc,"Participant_Details,Participant_ID",none,bar,"x=Participant_Details,y=Participant_ID,color=none",x asc,none
"Display the count of event details, from low to high",abstract,Bar,Medium,EVENTS,local_govt_in_alabama,mark bar data events encoding x event_details y aggregate count event_details transform group x sort y asc,Event_Details,count Event_Details,bar,"x=Event_Details,y=count Event_Details,color=none",y asc,none
Give me a graph of each event details count.,abstract,Bar,Easy,EVENTS,local_govt_in_alabama,mark bar data events encoding x event_details y aggregate count event_details transform group x,Event_Details,count Event_Details,bar,"x=Event_Details,y=count Event_Details,color=none",none,none
What's the ratio of event details in a chart?,abstract,Pie,Easy,EVENTS,local_govt_in_alabama,mark arc data events encoding x event_details y aggregate count event_details transform group x,Event_Details,count Event_Details,arc,"x=Event_Details,y=count Event_Details,color=none",none,none
"Show the team distribution for technicians, sorted by name.",abstract,Bar,Medium,technician,machine_repair,mark bar data technician encoding x team y aggregate count team transform group x sort x asc,Team,count Team,bar,"x=Team,y=count Team,color=none",x asc,none
Chart the proportion of each team's technicians.,abstract,Pie,Easy,technician,machine_repair,mark arc data technician encoding x team y aggregate count team transform group x,Team,count Team,arc,"x=Team,y=count Team,color=none",none,none
"Make a graph of the sum revenue of founders, sorted by revenue",abstract,Bar,Medium,manufacturers,manufactory_1,mark bar data manufacturers encoding x founder y aggregate sum revenue transform group x sort x asc,"Founder,Revenue",sum Revenue,bar,"x=Founder,y=sum Revenue,color=none",x asc,none
Plot the revenue of each manufacturer from highest to lowest.,abstract,Bar,Easy,manufacturers,manufactory_1,mark bar data manufacturers encoding x name y aggregate none revenue transform sort y desc,"Name,Revenue",none,bar,"x=Name,y=Revenue,color=none",y desc,none
Display the types of products in a chart.,abstract,Bar,Easy,Products,solvency_ii,mark bar data products encoding x product_type_code y aggregate count product_type_code transform group x,Product_Type_Code,count Product_Type_Code,bar,"x=Product_Type_Code,y=count Product_Type_Code,color=none",none,none
Give me a breakdown of product types.,abstract,Pie,Easy,Products,solvency_ii,mark arc data products encoding x product_type_code y aggregate count product_type_code transform group x,Product_Type_Code,count Product_Type_Code,arc,"x=Product_Type_Code,y=count Product_Type_Code,color=none",none,none
What's the average cost of products by type?,abstract,Scatter,Easy,Products,manufactory_1,mark point data products encoding x avg(price) y aggregate none manufacturer transform group manufacturer,"Price,Manufacturer",avg Price,point,"x=avg Price,y=Manufacturer,color=none",none,none
Show me the proportion of components of furnitures that have more than 10 pieces.,abstract,Pie,Easy,furniture,manufacturer,mark arc data furniture encoding x name y aggregate none num_of_component transform filter num_of_component > 10,"Name,Num_of_Component",none,arc,"x=Name,y=Num_of_Component,color=none",none,Num_of_Component gt 10
Can I see the components of each furniture item with more than 10 parts from low to high?,abstract,Bar,Medium,furniture,manufacturer,mark bar data furniture encoding x name y aggregate none num_of_component transform filter num_of_component > 10 sort y asc,"Name,Num_of_Component",none,bar,"x=Name,y=Num_of_Component,color=none",y asc,Num_of_Component gt 10
Plot the number of players with points below 30 for each position in descending order,abstract,Bar,Hard,player,sports_competition,mark bar data player encoding x position y aggregate count position transform filter points < 30 group x sort y desc,Position,count Position,bar,"x=Position,y=count Position,color=none",y desc,Points lt 30
What's the ratio of male and female players?,abstract,Pie,Easy,player,riding_club,mark arc data player encoding x gender y aggregate count gender transform group x,Gender,count Gender,arc,"x=Gender,y=count Gender,color=none",none,none
Can I get a chart of the players by occupation with most at the top?,abstract,Bar,Medium,player,riding_club,mark bar data player encoding x occupation y aggregate count occupation transform group x sort y desc,Occupation,count Occupation,bar,"x=Occupation,y=count Occupation,color=none",y desc,none
Plot the positions with the most players at top.,abstract,Bar,Medium,match_season,match_season,mark bar data match_season encoding x position y aggregate count position transform group x sort y desc,Position,count Position,bar,"x=Position,y=count Position,color=none",y desc,none
Can I see the draft pick numbers and classes for Defenders?,abstract,Bar,Easy,match_season,match_season,"mark bar data match_season encoding x draft_class y aggregate none draft_pick_number transform filter position = ""defender""","Draft_Class,Draft_Pick_Number",none,bar,"x=Draft_Class,y=Draft_Pick_Number,color=none",none,"Position = ""Defender"""
Display an overview of the positions of players.,abstract,Pie,Easy,match_season,match_season,mark arc data match_season encoding x position y aggregate count position transform group x,Position,count Position,arc,"x=Position,y=count Position,color=none",none,none
Compare the number of lenses from each brand in reverse,abstract,Bar,Medium,camera_lens,mountain_photos,mark bar data camera_lens encoding x brand y aggregate count brand transform group x ,brand,count brand,bar,"x=brand,y=count brand,color=none",none,none
Show me the proportion of each brand.,abstract,Pie,Easy,camera_lens,mountain_photos,mark arc data camera_lens encoding x brand y aggregate count brand transform group x,brand,count brand,arc,"x=brand,y=count brand,color=none",none,none
Graph of the various colors,abstract,Bar,Easy,photos,mountain_photos,mark bar data photos encoding x color y aggregate count color transform group x,"color,y",count,bar,"x=color,y=count,color=y",none,none
Plot the counts of each color from low to high.,abstract,Bar,Medium,photos,mountain_photos,mark bar data photos encoding x color y aggregate count color transform group x sort y asc,"color,y",count,bar,"x=color,y=count,color=y",y asc,none
What's the proportion of different hues?,abstract,Pie,Easy,photos,mountain_photos,mark arc data photos encoding x color y aggregate count color transform group x,"color,y",count,arc,"x=color,y=count,color=y",none,none
Draw a graph of those with a membership above 4.,abstract,Bar,Easy,visitor,museum_visit,mark bar data visitor encoding x name y aggregate none level_of_membership transform filter level_of_membership > 4,"Name,Level_of_membership",none,bar,"x=Name,y=Level_of_membership,color=none",none,Level_of_membership gt 4
Show me the visitors ration with membership level greater than 4.,abstract,Pie,Easy,visitor,museum_visit,mark arc data visitor encoding x name y aggregate none level_of_membership transform filter level_of_membership > 4,"Name,Level_of_membership",none,arc,"x=Name,y=Level_of_membership,color=none",none,Level_of_membership gt 4
Give me the percentage of songs from each format.,abstract,Pie,Easy,files,music_1,mark arc data files encoding x formats y aggregate count formats transform group x,formats,count formats,arc,"x=formats,y=count formats,color=none",none,none
Plot the sorted average rating of songs by language.,abstract,Bar,Medium,song,music_1,mark bar data song encoding x languages y aggregate mean rating transform group x sort y desc,"languages,rating",mean rating,bar,"x=languages,y=mean rating,color=none",y desc,none
Display average song ratings by language.,abstract,Bar,Easy,song,music_1,mark bar data song encoding x languages y aggregate mean rating transform group x,"languages,rating",mean rating,bar,"x=languages,y=mean rating,color=none",none,none
Show me a breakdown of song avg ratings by language.,abstract,Pie,Easy,song,music_1,mark arc data song encoding x languages y aggregate mean rating transform group x,"languages,rating",mean rating,arc,"x=languages,y=mean rating,color=none",none,none
Generate a chart of the sorted categories of music festivals with result awarded. ,abstract,Bar,Hard,music_festival,music_4,"mark bar data music_festival encoding x category y aggregate count category transform filter result = ""awarded"" group x sort y asc",Category,count Category,bar,"x=Category,y=count Category,color=none",y asc,"Result = ""Awarded"""
What's the ratio of music festival types that have been awarded?,abstract,Pie,Medium,music_festival,music_4,"mark arc data music_festival encoding x category y aggregate count category transform filter result = ""awarded"" group x",Category,count Category,arc,"x=Category,y=count Category,color=none",none,"Result = ""Awarded"""
Give me a breakdown of the results of the music festivals.,abstract,Pie,Easy,music_festival,music_4,mark arc data music_festival encoding x result y aggregate count result transform group x,Result,count Result,arc,"x=Result,y=count Result,color=none",none,none
Generate a graph of non-US artists  by year in ordered.,abstract,Bar,Medium,artist,theme_gallery,mark bar data artist encoding x year_join y aggregate count year_join transform filter country != 'united states' group x sort y asc,Year_Join,count Year_Join,bar,"x=Year_Join,y=count Year_Join,color=none",y asc,Country != 'United States'
What is the percentage of countries in the artist table?,abstract,Pie,Easy,artist,theme_gallery,mark arc data artist encoding x country y aggregate count country transform group x,Country,count Country,arc,"x=Country,y=count Country,color=none",none,none
Plot the year of the non-US artists when they joined in ascending order.,abstract,Stacked Bar,Hard,artist,theme_gallery,mark bar data artist encoding x year_join y aggregate count year_join transform filter country != 'united states' group name sort y asc,"Year_Join,Name",count Year_Join,bar,"x=Year_Join,y=count Year_Join,color=Name",y asc,Country != 'United States'
Plot the average grades for each name.,abstract,Bar,Easy,Highschooler,network_1,mark bar data highschooler encoding x name y aggregate mean grade transform group x,"name,grade",mean grade,bar,"x=name,y=mean grade,color=none",none,none
Draw the amount of people under 40 by gender.,abstract,Bar,Medium,Person,network_2,mark bar data person encoding x gender y aggregate count gender transform filter age < 40 group x,gender,count gender,bar,"x=gender,y=count gender,color=none",none,age lt 40
Make me a bar graph for the reversely sorted average age per nationality.,abstract,Bar,Medium,journalist,news_report,mark bar data journalist encoding x nationality y aggregate mean age transform group x sort y desc,"Nationality,Age",mean Age,bar,"x=Nationality,y=mean Age,color=none",y desc,none
Illustrate the number of journalists by nationality on a graph.,abstract,Bar,Easy,journalist,news_report,mark bar data journalist encoding x nationality y aggregate count nationality transform group x,Nationality,count Nationality,bar,"x=Nationality,y=count Nationality,color=none",none,none
Chart the different party locations.,abstract,Bar,Easy,party,party_host,mark bar data party encoding x location y aggregate count location transform group x,Location,count Location,bar,"x=Location,y=count Location,color=none",none,none
Illustrate the proportion of ministers.,abstract,Pie,Easy,party,party_people,mark arc data party encoding x minister y aggregate count minister transform group x,Minister,count Minister,arc,"x=Minister,y=count Minister,color=none",none,none
Plot the amount of hosts per nationality in order.,abstract,Bar,Medium,HOST,party_host,mark bar data host encoding x nationality y aggregate count nationality transform group x sort y asc,Nationality,count Nationality,bar,"x=Nationality,y=count Nationality,color=none",y asc,none
Visualize the host numbers  by nationality.,abstract,Bar,Easy,HOST,party_host,mark bar data host encoding x nationality y aggregate count nationality transform group x,Nationality,count Nationality,bar,"x=Nationality,y=count Nationality,color=none",none,none
Draw the hosts ratio of each nationality.,abstract,Pie,Easy,HOST,party_host,mark arc data host encoding x nationality y aggregate count nationality transform group x,Nationality,count Nationality,arc,"x=Nationality,y=count Nationality,color=none",none,none
Rank the number of each location in a graph.,abstract,Bar,Medium,performance,performance_attendance,mark bar data performance encoding x location y aggregate count location transform group x ,Location,count Location,bar,"x=Location,y=count Location,color=none",none,none
