nl,nl type,chart,hardness,table name,database,label,column,aggregate,mark,encoding,sort,filter
"Give me a visualization of ACC_Road and Team_ID, grouped by All_Home.",abstract,Stacked Bar,Extra Hard,basketball_match,university_basketball,mark bar data basketball_match encoding x acc_road y aggregate none team_id color all_home transform group x,"ACC_Road,Team_ID,All_Home",none,bar,"x=ACC_Road,y=Team_ID,color=All_Home",none,none
"What's the distribution of ACC_Road and Team_ID, with All_Home as grouping factor? ",abstract,Stacked Bar,Extra Hard,basketball_match,university_basketball,mark bar data basketball_match encoding x acc_road y aggregate none team_id color all_home transform group x,"ACC_Road,Team_ID,All_Home",none,bar,"x=ACC_Road,y=Team_ID,color=All_Home",none,none
"Create a visual representation with Team_ID and ACC_Road, grouped by All_Home.",abstract,Stacked Bar,Extra Hard,basketball_match,university_basketball,mark bar data basketball_match encoding x acc_road y aggregate none team_id color all_home transform group x,"ACC_Road,Team_ID,All_Home",none,bar,"x=ACC_Road,y=Team_ID,color=All_Home",none,none
Show me the distribution of states in the votes.,abstract,Pie,Medium,votes,voter_1,mark arc data votes encoding x distinct y aggregate count state transform group state,"distinct,state",count state,arc,"x=distinct,y=, count state,color=none",none,none
What's the breakdown of states in the table?,abstract,Pie,Medium,votes,voter_1,mark arc data votes encoding x distinct y aggregate count state transform group state,"distinct,state",count state,arc,"x=distinct,y=, count state,color=none",none,none
What percentage of votes came from each state?,abstract,Pie,Medium,votes,voter_1,mark arc data votes encoding x distinct y aggregate count state transform group state,"distinct,state",count state,arc,"x=distinct,y=, count state,color=none",none,none
How are states distributed in the votes?,abstract,Pie,Medium,votes,voter_1,mark arc data votes encoding x distinct y aggregate count state transform group state,"distinct,state",count state,arc,"x=distinct,y=, count state,color=none",none,none
What's the trend of churches opening over the years?,abstract,Line,Easy,Church,wedding,mark line data church encoding x open_date y aggregate count open_date transform group x ,Open_Date,count Open_Date,line,"x=Open_Date,y=count Open_Date,color=none",none,none
"Display the number of churches opened, from most recent to oldest.",abstract,Line,Easy,Church,wedding,mark line data church encoding x open_date y aggregate count open_date transform group x sort x desc,Open_Date,count Open_Date,line,"x=Open_Date,y=count Open_Date,color=none",x desc,none
Show a graph of open dates for the churches.,abstract,Line,Easy,Church,wedding,mark line data church encoding x open_date y aggregate count open_date transform group x ,Open_Date,count Open_Date,line,"x=Open_Date,y=count Open_Date,color=none",none,none
"Can you give me the chart of churches opening, sorted by time?",abstract,Line,Easy,Church,wedding,mark line data church encoding x open_date y aggregate count open_date transform group x sort x desc,Open_Date,count Open_Date,line,"x=Open_Date,y=count Open_Date,color=none",x desc,none
"Show me the count of wines by grape type with a graph, descending order on Y axis.",abstract,Bar,Medium,WINE,wine_1,mark bar data wine encoding x grape y aggregate count grape transform group x sort y asc,Grape,count Grape,bar,"x=Grape,y=count Grape,color=None",y asc,none
"Can I see a graph of wines by grape, sorted by Y axis in descending order?",abstract,Bar,Medium,WINE,wine_1,mark bar data wine encoding x grape y aggregate count grape transform group x sort y asc,Grape,count Grape,bar,"x=Grape,y=count Grape,color=None",y asc,none
"Visualize the number of wines by grape, in descending order on the Y.",abstract,Bar,Medium,WINE,wine_1,mark bar data wine encoding x grape y aggregate count grape transform group x sort y asc,Grape,count Grape,bar,"x=Grape,y=count Grape,color=None",y asc,none
"Display a graph of wine quantity by grape, in descending order on Y axis.",abstract,Bar,Medium,WINE,wine_1,mark bar data wine encoding x grape y aggregate count grape transform group x sort y asc,Grape,count Grape,bar,"x=Grape,y=count Grape,color=None",y asc,none
"Give me a graph of the number of wines by grape type, descending order on the Y axis.",abstract,Bar,Medium,WINE,wine_1,mark bar data wine encoding x grape y aggregate count grape transform group x sort y asc,Grape,count Grape,bar,"x=Grape,y=count Grape,color=None",y asc,none
"Can I get a chart showing the amount of different wines, sorted by Y axis in descending order?",abstract,Bar,Medium,WINE,wine_1,mark bar data wine encoding x grape y aggregate count grape transform group x sort y asc,Grape,count Grape,bar,"x=Grape,y=count Grape,color=None",y asc,none
What's the highest score of wines by year?,abstract,Line,Easy,WINE,wine_1,mark line data wine encoding x year y aggregate max score transform group x sort x desc,"Year,Score",max Score,line,"x=Year,y=max Score,color=None",x desc,none
Show me the trend of maximum wine scores in descending order.,abstract,Line,Easy,WINE,wine_1,mark line data wine encoding x year y aggregate max score transform group x sort x desc,"Year,Score",max Score,line,"x=Year,y=max Score,color=None",x desc,none
Plot the maximum score of wines over the years in descending order.,abstract,Line,Easy,WINE,wine_1,mark line data wine encoding x year y aggregate max score transform group x sort x desc,"Year,Score",max Score,line,"x=Year,y=max Score,color=None",x desc,none
"What's the chart of maximum wine score by year, descending?",abstract,Line,Easy,WINE,wine_1,mark line data wine encoding x year y aggregate max score transform group x sort x desc,"Year,Score",max Score,line,"x=Year,y=max Score,color=None",x desc,none
"Can you generate a chart of wineries and grapes with the wines whose price is more than 100, with the y-axis showing the number of wineries in descending order?",abstract,Stacked Bar,Extra Hard,WINE,wine_1,mark bar data wine encoding x winery y aggregate count winery color grape transform filter price > 100 group x sort y desc,"Winery,Grape",count Winery,bar,"x=Winery,y=count Winery,color=Grape",y desc,Price gt 100
"Show me wines with a price more than 100 using a stacked bar chart, graphing wineries and grape varieties on the x-axis and number of wineries on the y-axis, descending.",abstract,Stacked Bar,Extra Hard,WINE,wine_1,mark bar data wine encoding x winery y aggregate count winery color grape transform filter price > 100 group x sort y desc,"Winery,Grape",count Winery,bar,"x=Winery,y=count Winery,color=Grape",y desc,Price gt 100
"Give me a chart of wineries with more than 100 price wines, graphing grape varieties and wineries on the x-axis and number of wineries on the y-axis, from high to low.",abstract,Stacked Bar,Extra Hard,WINE,wine_1,mark bar data wine encoding x winery y aggregate count winery color grape transform filter price > 100 group x sort y desc,"Winery,Grape",count Winery,bar,"x=Winery,y=count Winery,color=Grape",y desc,Price gt 100
"Create a chart showing the proportion of the number of grape of the wines with a price above 100, ordered by year.",abstract,Pie,Medium,WINE,wine_1,mark arc data wine encoding x grape y aggregate count grape transform filter price > 100 group x,Grape,count Grape,arc,"x=Grape,y=count Grape,color=None",none,Price gt 100
"What's the proportion of the number of grape of the wines with a price more than 100, grouped by year?",abstract,Pie,Medium,WINE,wine_1,mark arc data wine encoding x grape y aggregate count grape transform filter price > 100 group x,Grape,count Grape,arc,"x=Grape,y=count Grape,color=None",none,Price gt 100
"Visualize data about the number of grape of the wines with a price greater than 100, organized by year.",abstract,Pie,Medium,WINE,wine_1,mark arc data wine encoding x grape y aggregate count grape transform filter price > 100 group x,Grape,count Grape,arc,"x=Grape,y=count Grape,color=None",none,Price gt 100
"Show me the proportion of the number of grape of the wines with a price over 100, arranged according to year.",abstract,Pie,Medium,WINE,wine_1,mark arc data wine encoding x grape y aggregate count grape transform filter price > 100 group x,Grape,count Grape,arc,"x=Grape,y=count Grape,color=None",none,Price gt 100
Plot the areas of each appellation.,abstract,Bar,Easy,APPELLATIONS,wine_1,mark bar data appellations encoding x area y aggregate count area transform group x,Area,count Area,bar,"x=Area,y=count Area,color=None",none,none
Create a graph of area distribution across appellations.,abstract,Bar,Easy,APPELLATIONS,wine_1,mark bar data appellations encoding x area y aggregate count area transform group x,Area,count Area,bar,"x=Area,y=count Area,color=None",none,none
Generate a chart of area numbers by appellation.,abstract,Bar,Easy,APPELLATIONS,wine_1,mark bar data appellations encoding x area y aggregate count area transform group x,Area,count Area,bar,"x=Area,y=count Area,color=None",none,none
Show me the area breakdown for each appellation.,abstract,Bar,Easy,APPELLATIONS,wine_1,mark bar data appellations encoding x area y aggregate count area transform group x,Area,count Area,bar,"x=Area,y=count Area,color=None",none,none
"Show me the number of counties in the appellations as a bar chart, arranged in order of least to greatest.",abstract,Bar,Medium,APPELLATIONS,wine_1,mark bar data appellations encoding x county y aggregate count county transform group x sort y asc,County,count County,bar,"x=County,y=count County,color=None",y asc,none
"Can you draw a bar graph of the county count of the appellations, smallest to largest?",abstract,Bar,Medium,APPELLATIONS,wine_1,mark bar data appellations encoding x county y aggregate count county transform group x sort y asc,County,count County,bar,"x=County,y=count County,color=None",y asc,none
"Graph the number of counties for appellations, least to most.",abstract,Bar,Medium,APPELLATIONS,wine_1,mark bar data appellations encoding x county y aggregate count county transform group x sort y asc,County,count County,bar,"x=County,y=count County,color=None",y asc,none
"Plot the county count of appellations, smallest to biggest.",abstract,Bar,Medium,APPELLATIONS,wine_1,mark bar data appellations encoding x county y aggregate count county transform group x sort y asc,County,count County,bar,"x=County,y=count County,color=None",y asc,none
Create a chart of the number of venues for each workshop.,abstract,Bar,Easy,workshop,workshop_paper,mark bar data workshop encoding x venue y aggregate count venue transform group x,Venue,count Venue,bar,"x=Venue,y=count Venue,color=none",none,none
Display how many venues the workshops had.,abstract,Bar,Easy,workshop,workshop_paper,mark bar data workshop encoding x venue y aggregate count venue transform group x,Venue,count Venue,bar,"x=Venue,y=count Venue,color=none",none,none
Draw a graph of the venues for the workshops.,abstract,Bar,Easy,workshop,workshop_paper,mark bar data workshop encoding x venue y aggregate count venue transform group x,Venue,count Venue,bar,"x=Venue,y=count Venue,color=none",none,none
Show a chart of the workshops' venues.,abstract,Bar,Easy,workshop,workshop_paper,mark bar data workshop encoding x venue y aggregate count venue transform group x,Venue,count Venue,bar,"x=Venue,y=count Venue,color=none",none,none
Make a visualization of the venues for the different workshops.,abstract,Bar,Easy,workshop,workshop_paper,mark bar data workshop encoding x venue y aggregate count venue transform group x,Venue,count Venue,bar,"x=Venue,y=count Venue,color=none",none,none
"Can you create a bar chart that displays the number of venues for each workshop, sorted from highest to lowest?",abstract,Bar,Medium,workshop,workshop_paper,mark bar data workshop encoding x venue y aggregate count venue transform group x sort y desc,Venue,count Venue,bar,"x=Venue,y=count Venue,color=none",y desc,none
"Can you make a bar graph of the number of venues by workshop, ordered by most to least?",abstract,Bar,Medium,workshop,workshop_paper,mark bar data workshop encoding x venue y aggregate count venue transform group x sort y desc,Venue,count Venue,bar,"x=Venue,y=count Venue,color=none",y desc,none
Can I get a visualization of the venues for each workshop in descending order?,abstract,Bar,Medium,workshop,workshop_paper,mark bar data workshop encoding x venue y aggregate count venue transform group x sort y desc,Venue,count Venue,bar,"x=Venue,y=count Venue,color=none",y desc,none
"Visualize the number of venues for each workshop, ranked in descending order.",abstract,Bar,Medium,workshop,workshop_paper,mark bar data workshop encoding x venue y aggregate count venue transform group x sort y desc,Venue,count Venue,bar,"x=Venue,y=count Venue,color=none",y desc,none
"Show me a chart of the venues of each workshop, ranked in descending order.",abstract,Bar,Medium,workshop,workshop_paper,mark bar data workshop encoding x venue y aggregate count venue transform group x sort y desc,Venue,count Venue,bar,"x=Venue,y=count Venue,color=none",y desc,none
Show me the distribution of acceptance results,abstract,Bar,Medium,acceptance,workshop_paper,mark bar data acceptance encoding x result y aggregate count result transform group x ,Result,count Result,bar,"x=Result,y=count Result,color=none",none,none
What's the breakdown of the acceptance results?,abstract,Bar,Medium,acceptance,workshop_paper,mark bar data acceptance encoding x result y aggregate count result transform group x ,Result,count Result,bar,"x=Result,y=count Result,color=none",none,none
Can I get a chart of the acceptance results?,abstract,Bar,Medium,acceptance,workshop_paper,mark bar data acceptance encoding x result y aggregate count result transform group x ,Result,count Result,bar,"x=Result,y=count Result,color=none",none,none
Graph the acceptance results,abstract,Bar,Medium,acceptance,workshop_paper,mark bar data acceptance encoding x result y aggregate count result transform group x ,Result,count Result,bar,"x=Result,y=count Result,color=none",none,none
Do a chart on the acceptance results,abstract,Bar,Medium,acceptance,workshop_paper,mark bar data acceptance encoding x result y aggregate count result transform group x ,Result,count Result,bar,"x=Result,y=count Result,color=none",none,none
Show me the breakdown of acceptance result.,abstract,Pie,Easy,acceptance,workshop_paper,mark arc data acceptance encoding x result y aggregate count result transform group x,Result,count Result,arc,"x=Result,y=count Result,color=none",none,none
What is the ratio of acceptance result?,abstract,Pie,Easy,acceptance,workshop_paper,mark arc data acceptance encoding x result y aggregate count result transform group x,Result,count Result,arc,"x=Result,y=count Result,color=none",none,none
What's the proportion of accepted submissions? ,abstract,Pie,Easy,acceptance,workshop_paper,mark arc data acceptance encoding x result y aggregate count result transform group x,Result,count Result,arc,"x=Result,y=count Result,color=none",none,none
Can you create a graph of acceptance results?,abstract,Pie,Easy,acceptance,workshop_paper,mark arc data acceptance encoding x result y aggregate count result transform group x,Result,count Result,arc,"x=Result,y=count Result,color=none",none,none
What does the acceptance result look like? ,abstract,Pie,Easy,acceptance,workshop_paper,mark arc data acceptance encoding x result y aggregate count result transform group x,Result,count Result,arc,"x=Result,y=count Result,color=none",none,none
Show me the acceptance result in a chart.,abstract,Pie,Easy,acceptance,workshop_paper,mark arc data acceptance encoding x result y aggregate count result transform group x,Result,count Result,arc,"x=Result,y=count Result,color=none",none,none
Display authors by submission count.,abstract,Bar,Medium,submission,workshop_paper,mark bar data submission encoding x author y aggregate count author transform group x ,Author,count Author,bar,"x=Author,y=count Author,color=none",none,none
Show me the submission counts for authors.,abstract,Bar,Medium,submission,workshop_paper,mark bar data submission encoding x author y aggregate count author transform group x ,Author,count Author,bar,"x=Author,y=count Author,color=none",none,none
What does the distribution of author submissions look like?,abstract,Bar,Medium,submission,workshop_paper,mark bar data submission encoding x author y aggregate count author transform group x ,Author,count Author,bar,"x=Author,y=count Author,color=none",none,none
Show me a graph of authors and submission numbers.,abstract,Bar,Medium,submission,workshop_paper,mark bar data submission encoding x author y aggregate count author transform group x ,Author,count Author,bar,"x=Author,y=count Author,color=none",none,none
Graph the number of authors' submissions.,abstract,Bar,Medium,submission,workshop_paper,mark bar data submission encoding x author y aggregate count author transform group x ,Author,count Author,bar,"x=Author,y=count Author,color=none",none,none
Plot the number of authors and their submissions.,abstract,Bar,Medium,submission,workshop_paper,mark bar data submission encoding x author y aggregate count author transform group x ,Author,count Author,bar,"x=Author,y=count Author,color=none",none,none
Graph the number of authors in the table.,abstract,Bar,Easy,submission,workshop_paper,mark bar data submission encoding x author y aggregate count author transform group x,Author,count Author,bar,"x=Author,y=count Author,color=none",none,none
Plot the authors and their submissions.,abstract,Bar,Easy,submission,workshop_paper,mark bar data submission encoding x author y aggregate count author transform group x,Author,count Author,bar,"x=Author,y=count Author,color=none",none,none
Present the authors and scores in a chart.,abstract,Bar,Easy,submission,workshop_paper,mark bar data submission encoding x author y aggregate count author transform group x,Author,count Author,bar,"x=Author,y=count Author,color=none",none,none
Display the author data in a graph.,abstract,Bar,Easy,submission,workshop_paper,mark bar data submission encoding x author y aggregate count author transform group x,Author,count Author,bar,"x=Author,y=count Author,color=none",none,none
Show the authors and their scores.,abstract,Bar,Easy,submission,workshop_paper,mark bar data submission encoding x author y aggregate count author transform group x,Author,count Author,bar,"x=Author,y=count Author,color=none",none,none
Create a pie chart of the different authors.,abstract,Pie,Easy,submission,workshop_paper,mark arc data submission encoding x author y aggregate count author transform group x,Author,count Author,arc,"x=Author,y=count Author,color=none",none,none
Can we get a visualization of the authors and their submissions?,abstract,Pie,Easy,submission,workshop_paper,mark arc data submission encoding x author y aggregate count author transform group x,Author,count Author,arc,"x=Author,y=count Author,color=none",none,none
Make a graph of the submissions by author.,abstract,Pie,Easy,submission,workshop_paper,mark arc data submission encoding x author y aggregate count author transform group x,Author,count Author,arc,"x=Author,y=count Author,color=none",none,none
Show me the authors who submitted to the workshop.,abstract,Pie,Easy,submission,workshop_paper,mark arc data submission encoding x author y aggregate count author transform group x,Author,count Author,arc,"x=Author,y=count Author,color=none",none,none
Can you show me a chart of the continents with the lowest life expectancies?,abstract,Bar,Medium,country,world_1,mark bar data country encoding x continent y aggregate mean lifeexpectancy transform group x sort y asc,"Continent,LifeExpectancy",mean LifeExpectancy,bar,"x=Continent,y=mean LifeExpectancy,color=none",y asc,none
Plot life expectancy of all continents in order from least to greatest?,abstract,Bar,Medium,country,world_1,mark bar data country encoding x continent y aggregate mean lifeexpectancy transform group x sort y asc,"Continent,LifeExpectancy",mean LifeExpectancy,bar,"x=Continent,y=mean LifeExpectancy,color=none",y asc,none
Show me the distribution of teams in the elimination in a pie chart. ,abstract,Pie,Easy,elimination,wrestler,mark arc data elimination encoding x team y aggregate count team transform group x,Team,count Team,arc,"x=Team,y=count Team,color=none",none,none
Can you illustrate how many teams are in the elimination with a pie chart? ,abstract,Pie,Easy,elimination,wrestler,mark arc data elimination encoding x team y aggregate count team transform group x,Team,count Team,arc,"x=Team,y=count Team,color=none",none,none
Draw a graph demonstrating the teams in the elimination. ,abstract,Pie,Easy,elimination,wrestler,mark arc data elimination encoding x team y aggregate count team transform group x,Team,count Team,arc,"x=Team,y=count Team,color=none",none,none
Show me the proportion of teams in the elimination with a pie chart. ,abstract,Pie,Easy,elimination,wrestler,mark arc data elimination encoding x team y aggregate count team transform group x,Team,count Team,arc,"x=Team,y=count Team,color=none",none,none
Give me a pie chart of the teams in the elimination.,abstract,Pie,Easy,elimination,wrestler,mark arc data elimination encoding x team y aggregate count team transform group x,Team,count Team,arc,"x=Team,y=count Team,color=none",none,none
Show how many locations the wrestlers have with a bar chart.,abstract,Bar,Easy,wrestler,wrestler,mark bar data wrestler encoding x location y aggregate count location transform group x,Location,count Location,bar,"x=Location,y=count Location,color=none",none,none
Visualize the number of locations the wrestlers have.,abstract,Bar,Easy,wrestler,wrestler,mark bar data wrestler encoding x location y aggregate count location transform group x,Location,count Location,bar,"x=Location,y=count Location,color=none",none,none
Create a bar graph for the amount of locations of the wrestlers.,abstract,Bar,Easy,wrestler,wrestler,mark bar data wrestler encoding x location y aggregate count location transform group x,Location,count Location,bar,"x=Location,y=count Location,color=none",none,none
Create a chart to show the number of locations of the wrestlers.,abstract,Bar,Easy,wrestler,wrestler,mark bar data wrestler encoding x location y aggregate count location transform group x,Location,count Location,bar,"x=Location,y=count Location,color=none",none,none
What is the distribution of locations of the wrestlers? Draw a chart.,abstract,Bar,Easy,wrestler,wrestler,mark bar data wrestler encoding x location y aggregate count location transform group x,Location,count Location,bar,"x=Location,y=count Location,color=none",none,none
Draw a bar graph for the locations of the wrestlers.,abstract,Bar,Easy,wrestler,wrestler,mark bar data wrestler encoding x location y aggregate count location transform group x,Location,count Location,bar,"x=Location,y=count Location,color=none",none,none
Show me the locations of wrestlers in a bar chart ordered from least to most.,abstract,Bar,Medium,wrestler,wrestler,mark bar data wrestler encoding x location y aggregate count location transform group x sort x asc,Location,count Location,bar,"x=Location,y=count Location,color=none",x asc,none
What is the distribution of locations of wrestlers in a bar chart?,abstract,Bar,Medium,wrestler,wrestler,mark bar data wrestler encoding x location y aggregate count location transform group x ,Location,count Location,bar,"x=Location,y=count Location,color=none",none,none
"Make a bar chart of wrestlers' location, ordered from least to most.",abstract,Bar,Medium,wrestler,wrestler,mark bar data wrestler encoding x location y aggregate count location transform group x sort x asc,Location,count Location,bar,"x=Location,y=count Location,color=none",x asc,none
Can you draw a bar chart of locations for the wrestlers ordered from least to most?,abstract,Bar,Medium,wrestler,wrestler,mark bar data wrestler encoding x location y aggregate count location transform group x sort x asc,Location,count Location,bar,"x=Location,y=count Location,color=none",x asc,none
"Visualize the locations of wrestlers in a bar chart, least to most.",abstract,Bar,Medium,wrestler,wrestler,mark bar data wrestler encoding x location y aggregate count location transform group x sort x asc,Location,count Location,bar,"x=Location,y=count Location,color=none",x asc,none
Visualize the reign and days held of wrestlers.,abstract,Scatter,Easy,wrestler,wrestler,mark point data wrestler encoding x reign y aggregate none days_held,"Reign,Days_held",none,point,"x=Reign,y=Days_held,color=none",none,none
Show me a graph of the wrestlers' reigns and days held.,abstract,Scatter,Easy,wrestler,wrestler,mark point data wrestler encoding x reign y aggregate none days_held,"Reign,Days_held",none,point,"x=Reign,y=Days_held,color=none",none,none
Plot the reigns and days held of all wrestlers.,abstract,Scatter,Easy,wrestler,wrestler,mark point data wrestler encoding x reign y aggregate none days_held,"Reign,Days_held",none,point,"x=Reign,y=Days_held,color=none",none,none
Create a chart of wrestler's reign and days held.,abstract,Scatter,Easy,wrestler,wrestler,mark point data wrestler encoding x reign y aggregate none days_held,"Reign,Days_held",none,point,"x=Reign,y=Days_held,color=none",none,none
Make a graph for the reigns and days held of wrestlers.,abstract,Scatter,Easy,wrestler,wrestler,mark point data wrestler encoding x reign y aggregate none days_held,"Reign,Days_held",none,point,"x=Reign,y=Days_held,color=none",none,none
Show me the count of players by hand type?,abstract,Bar,Medium,players,wta_1,mark bar data players encoding x hand y aggregate count hand transform group x ,hand,count hand,bar,"x=hand,y=count hand,color=none",none,none
