nl,nl type,chart,hardness,table name,database,label,column,aggregate,mark,encoding,sort,filter
"Show budget type codes and the number of documents in each budget type Show bar chart, and sort from low to high by the X.",original,Bar,Medium,Documents_with_expenses,cre_Docs_and_Epenses,mark bar data documents_with_expenses encoding x budget_type_code y aggregate count budget_type_code transform group x sort x asc,Budget_Type_Code,count Budget_Type_Code,bar,"x=Budget_Type_Code,y=count Budget_Type_Code,color=none",x asc,none
Give me a bar chart for the total number of each budget type code.,original,Bar,Easy,Documents_with_expenses,cre_Docs_and_Epenses,mark bar data documents_with_expenses encoding x budget_type_code y aggregate count budget_type_code transform group x,Budget_Type_Code,count Budget_Type_Code,bar,"x=Budget_Type_Code,y=count Budget_Type_Code,color=none",none,none
Compute the total the total number across budget type code as a pie chart.,original,Pie,Easy,Documents_with_expenses,cre_Docs_and_Epenses,mark arc data documents_with_expenses encoding x budget_type_code y aggregate count budget_type_code transform group x,Budget_Type_Code,count Budget_Type_Code,arc,"x=Budget_Type_Code,y=count Budget_Type_Code,color=none",none,none
"Plot a scatter chart, customer id by account_name.",original,Scatter,Easy,Accounts,customers_card_transactions,mark point data accounts encoding x customer_id y aggregate none account_name,"customer_id,account_name",none,point,"x=customer_id,y=account_name,color=none",none,none
Scatterplot of account_name vs account id by other_account_details,original,Grouping Scatter,Easy,Accounts,customers_and_invoices,mark point data accounts encoding x account_id y aggregate none account_name transform group other_account_details,"account_id,account_name,other_account_details",none,point,"x=account_id,y=account_name,color=other_account_details",none,none
Give me a pie to show how many other account details from different other account details.,original,Pie,Easy,Accounts,customers_and_invoices,mark arc data accounts encoding x other_account_details y aggregate count other_account_details transform group x,other_account_details,count other_account_details,arc,"x=other_account_details,y=count other_account_details,color=none",none,none
"Bar graph to show the number of document type description from different document type description, and I want to order in descending by the Y.",original,Bar,Medium,Ref_document_types,cre_Docs_and_Epenses,mark bar data ref_document_types encoding x document_type_description y aggregate count document_type_description transform group x sort y desc,Document_Type_Description,count Document_Type_Description,bar,"x=Document_Type_Description,y=count Document_Type_Description,color=none",y desc,none
How many document type for different document type description? Visualize with a bar chart.,original,Bar,Easy,Ref_document_types,cre_Docs_and_Epenses,mark bar data ref_document_types encoding x document_type_description y aggregate count document_type_description transform group x,Document_Type_Description,count Document_Type_Description,bar,"x=Document_Type_Description,y=count Document_Type_Description,color=none",none,none
Compute the total the number of document type description across document type description as a pie chart.,original,Pie,Easy,Ref_document_types,cre_Docs_and_Epenses,mark arc data ref_document_types encoding x document_type_description y aggregate count document_type_description transform group x,Document_Type_Description,count Document_Type_Description,arc,"x=Document_Type_Description,y=count Document_Type_Description,color=none",none,none
"For each distinct product name, show its average product price, show X-axis from high to low order.",original,Bar,Medium,PRODUCTS,cre_Drama_Workshop_Groups,mark bar data products encoding x product_name y aggregate mean product_price transform group x sort x desc,"Product_Name,Product_Price",mean Product_Price,bar,"x=Product_Name,y=mean Product_Price,color=none",x desc,none
What are the different product names? What is the average product price for each of them. Show bar chart.,original,Bar,Easy,PRODUCTS,cre_Drama_Workshop_Groups,mark bar data products encoding x product_name y aggregate mean product_price transform group x,"Product_Name,Product_Price",mean Product_Price,bar,"x=Product_Name,y=mean Product_Price,color=none",none,none
Give the proportion of what are the different product names? What is the average product price for each of them?,original,Pie,Easy,PRODUCTS,cre_Drama_Workshop_Groups,mark arc data products encoding x product_name y aggregate mean product_price transform group x,"Product_Name,Product_Price",mean Product_Price,arc,"x=Product_Name,y=mean Product_Price,color=none",none,none
"Show all payment method codes and the number of orders for each code in a bar chart, list by the Y from high to low.",original,Bar,Medium,INVOICES,cre_Drama_Workshop_Groups,mark bar data invoices encoding x payment_method_code y aggregate count payment_method_code transform group x sort y desc,payment_method_code,count payment_method_code,bar,"x=payment_method_code,y=count payment_method_code,color=none",y desc,none
Show all payment method codes and the number of orders for each code by a pie chart.,original,Pie,Easy,INVOICES,cre_Drama_Workshop_Groups,mark arc data invoices encoding x payment_method_code y aggregate count payment_method_code transform group x,payment_method_code,count payment_method_code,arc,"x=payment_method_code,y=count payment_method_code,color=none",none,none
"Show different ways to get to attractions and the number of attractions that can be accessed in the corresponding way in a bar chart, and show by the bars from high to low.",original,Bar,Medium,Tourist_Attractions,cre_Theme_park,mark bar data tourist_attractions encoding x how_to_get_there y aggregate count how_to_get_there transform group x sort x desc,How_to_Get_There,count How_to_Get_There,bar,"x=How_to_Get_There,y=count How_to_Get_There,color=none",x desc,none
"List all the possible ways to get to attractions, together with the number of attractions accessible by these methods in a bar chart.",original,Bar,Easy,Tourist_Attractions,cre_Theme_park,mark bar data tourist_attractions encoding x how_to_get_there y aggregate count how_to_get_there transform group x,How_to_Get_There,count How_to_Get_There,bar,"x=How_to_Get_There,y=count How_to_Get_There,color=none",none,none
"Visualize a bar chart for how many books fall into each category?, sort the total number in descending order.",original,Bar,Medium,book_club,culture_company,mark bar data book_club encoding x category y aggregate count category transform group x sort y desc,Category,count Category,bar,"x=Category,y=count Category,color=none",y desc,none
Show all book categories and the number of books in each category with a bar chart.,original,Bar,Easy,book_club,culture_company,mark bar data book_club encoding x category y aggregate count category transform group x,Category,count Category,bar,"x=Category,y=count Category,color=none",none,none
Show all book categories and the number of books in each category in a pie chart.,original,Pie,Easy,book_club,culture_company,mark arc data book_club encoding x category y aggregate count category transform group x,Category,count Category,arc,"x=Category,y=count Category,color=none",none,none
"Which directors had a movie in either 1999 or 2000, and count them by a bar chart, could you order X-axis in desc order?",original,Bar,Extra Hard,movie,culture_company,mark bar data movie encoding x director y aggregate count director transform filter year = 1999 or year = 2000 group x sort x desc,Director,count Director,bar,"x=Director,y=count Director,color=none",x desc,Year = 1999 or Year = 2000
"Show all director names who have a movie in the year 1999 or 2000, and count them by a bar chart",original,Bar,Hard,movie,culture_company,mark bar data movie encoding x director y aggregate count director transform filter year = 1999 or year = 2000 group x,Director,count Director,bar,"x=Director,y=count Director,color=none",none,Year = 1999 or Year = 2000
"For those products with a price between 60 and 120, draw a scatter chart about the correlation between code and price .",original,Scatter,Easy,products,manufactory_1,mark point data products encoding x code y aggregate none price transform filter price between 60 and 120,"Code,Price",none,point,"x=Code,y=Price,color=none",none,Price gte 60 and Price lte 120
"What are the names of the cheapest products in each category along with the cheapest price in a bar chart?, and rank in descending by the Y please.",original,Bar,Easy,products,manufactory_1,mark bar data products encoding x name y aggregate min price transform group x sort y desc,"Name,Price",min Price,bar,"x=Name,y=min Price,color=none",y desc,none
Show the number of products with price higher than 1000 or lower than 500 for each product name in a bar chart.,original,Bar,Hard,products,customers_and_products_contacts,mark bar data products encoding x product_name y aggregate count product_name transform filter product_price > 1000 or product_price < 500 group x,product_name,count product_name,bar,"x=product_name,y=count product_name,color=none",none,product_price gt 1000 or product_price lt 500
"Give me a bar chart for sum price of each name, I want to display by the x-axis in desc.",original,Bar,Medium,products,manufactory_1,mark bar data products encoding x name y aggregate sum price transform group x sort x desc,"Name,Price",sum Price,bar,"x=Name,y=sum Price,color=none",x desc,none
Show the relationship between minimum product price and maximum product price and group by product type code in a group scatter chart.,original,Grouping Scatter,Easy,products,department_store,mark point data products encoding x max(product_price) y aggregate min product_price transform group product_type_code,"product_price,product_type_code","max product_price,min product_price",point,"x=max product_price,y=min product_price,color=product_type_code",none,none
"Show the number of products with price higher than 1000 or lower than 500 for each product type code in a bar chart, and I want to list from high to low by the Y-axis please.",original,Bar,Extra Hard,products,customers_and_products_contacts,mark bar data products encoding x product_type_code y aggregate count product_type_code transform filter product_price > 1000 or product_price < 500 group x sort y desc,product_type_code,count product_type_code,bar,"x=product_type_code,y=count product_type_code,color=none",y desc,product_price gt 1000 or product_price lt 500
Take the first name of all the good customers as the X-axis and gender of all the good customers as Y-axis in a bar chart.,original,Bar,Easy,customers,products_for_hire,mark bar data customers encoding x first_name y aggregate none gender_mf transform filter good_or_bad_customer = 'good',"first_name,gender_mf",none,bar,"x=first_name,y=gender_mf,color=none",none,good_or_bad_customer = 'good'
"How many customers use each payment method, and display by the y axis in descending.",original,Bar,Medium,customers,department_store,mark bar data customers encoding x payment_method_code y aggregate count payment_method_code transform group x sort y desc,payment_method_code,count payment_method_code,bar,"x=payment_method_code,y=count payment_method_code,color=none",y desc,none
List all customer status codes and the number of customers having each status code in a bar chart.,original,Bar,Easy,Customers,driving_school,mark bar data customers encoding x customer_status_code y aggregate count customer_status_code transform group x,customer_status_code,count customer_status_code,bar,"x=customer_status_code,y=count customer_status_code,color=none",none,none
List all customer status codes and the number of customers having each status code by a pie chart.,original,Pie,Easy,Customers,driving_school,mark arc data customers encoding x customer_status_code y aggregate count customer_status_code transform group x,customer_status_code,count customer_status_code,arc,"x=customer_status_code,y=count customer_status_code,color=none",none,none
Show the number of customers for each gender in a scatter chart.,original,Scatter,Easy,Customers,customers_and_invoices,mark point data customers encoding x gender y aggregate count gender transform group x,gender,count gender,point,"x=gender,y=count gender,color=none",none,none
Show the order ids and the number of invoices for each order with a scatter chart.,original,Scatter,Easy,Invoices,customers_and_invoices,mark point data invoices encoding x order_id y aggregate count order_id transform group x,order_id,count order_id,point,"x=order_id,y=count order_id,color=none",none,none
Show the transaction type and the number of transactions by a bar chart.,original,Bar,Easy,Financial_transactions,customers_card_transactions,mark bar data financial_transactions encoding x transaction_type y aggregate count transaction_type transform group x,transaction_type,count transaction_type,bar,"x=transaction_type,y=count transaction_type,color=none",none,none
"What are total transaction amounts for each transaction type, could you show by the Y-axis from low to high?",original,Bar,Medium,Financial_transactions,customers_and_invoices,mark bar data financial_transactions encoding x transaction_type y aggregate sum transaction_amount transform group x sort y asc,"transaction_type,transaction_amount",sum transaction_amount,bar,"x=transaction_type,y=sum transaction_amount,color=none",y asc,none
Show the invoice number and the number of transactions for each invoice in a scatter chart,original,Scatter,Easy,Financial_transactions,customers_and_invoices,mark point data financial_transactions encoding x invoice_number y aggregate count invoice_number transform group x,invoice_number,count invoice_number,point,"x=invoice_number,y=count invoice_number,color=none",none,none
Show the transaction type and the number of transactions by a pie chart.,original,Pie,Easy,Financial_transactions,customers_card_transactions,mark arc data financial_transactions encoding x transaction_type y aggregate count transaction_type transform group x,transaction_type,count transaction_type,arc,"x=transaction_type,y=count transaction_type,color=none",none,none
"Show the total number from each state province county, and list in desc by the the total number .",original,Bar,Medium,addresses,customers_and_products_contacts,mark bar data addresses encoding x state_province_county y aggregate count state_province_county transform group x sort y desc,state_province_county,count state_province_county,bar,"x=state_province_county,y=count state_province_county,color=none",y desc,none
Show each state and the number of addresses in each state by a bar chart.,original,Bar,Easy,addresses,customers_and_products_contacts,mark bar data addresses encoding x state_province_county y aggregate count state_province_county transform group x,state_province_county,count state_province_county,bar,"x=state_province_county,y=count state_province_county,color=none",none,none
Show the number of premises for different premises type in a bar chart.,original,Bar,Medium,premises,customers_campaigns_ecommerce,mark bar data premises encoding x premises_type y aggregate count premises_type transform group x sort x,premises_type,count premises_type,bar,"x=premises_type,y=count premises_type,color=none",none,none
Show how many premises for different premises type in a pie chart.,original,Pie,Easy,premises,customers_campaigns_ecommerce,mark arc data premises encoding x premises_type y aggregate count premises_type transform group x,premises_type,count premises_type,arc,"x=premises_type,y=count premises_type,color=none",none,none
"How many cards in different card type code? Plot a bar chart, rank by the x axis in desc.",original,Bar,Medium,Customers_cards,customers_card_transactions,mark bar data customers_cards encoding x card_type_code y aggregate count card_type_code transform group x sort x desc,card_type_code,count card_type_code,bar,"x=card_type_code,y=count card_type_code,color=none",x desc,none
Show the relationship between customer id and card id with a scatter chart.,original,Scatter,Easy,Customers_cards,customers_card_transactions,mark point data customers_cards encoding x card_id y aggregate none customer_id,"card_id,customer_id",none,point,"x=card_id,y=customer_id,color=none",none,none
Show the number of cards in different card type code in a pie chart.,original,Pie,Easy,Customers_cards,customers_card_transactions,mark arc data customers_cards encoding x card_type_code y aggregate count card_type_code transform group x,card_type_code,count card_type_code,arc,"x=card_type_code,y=count card_type_code,color=none",none,none
Scatterplot of customer_id vs card id by card_type_code,original,Grouping Scatter,Easy,Customers_cards,customers_card_transactions,mark point data customers_cards encoding x card_id y aggregate none customer_id transform group card_type_code,"card_id,customer_id,card_type_code",none,point,"x=card_id,y=customer_id,color=card_type_code",none,none
"A bar chart showing how many debates are held for each venue, order in ascending by the x axis.",original,Bar,Medium,debate,debate,mark bar data debate encoding x venue y aggregate count venue transform group x sort x asc,Venue,count Venue,bar,"x=Venue,y=count Venue,color=none",x asc,none
"Show the average age of heads of departments born in each state with a bar chart, and could you display y-axis in descending order?",original,Bar,Medium,head,department_management,mark bar data head encoding x born_state y aggregate mean age transform group x sort y desc,"born_state,age",mean age,bar,"x=born_state,y=mean age,color=none",y desc,none
Show the average age of heads of departments born in each state with a bar chart.,original,Bar,Easy,head,department_management,mark bar data head encoding x born_state y aggregate mean age transform group x,"born_state,age",mean age,bar,"x=born_state,y=mean age,color=none",none,none
Show the number of heads of departments born in each state with a pie chart.,original,Pie,Easy,head,department_management,mark arc data head encoding x born_state y aggregate count born_state transform group x,born_state,count born_state,arc,"x=born_state,y=count born_state,color=none",none,none
"A bar chart about what are the different software platforms for devices, and how many devices have each?, and could you display by the x-axis in desc?",original,Bar,Medium,device,device,mark bar data device encoding x software_platform y aggregate count software_platform transform group x sort x desc,Software_Platform,count Software_Platform,bar,"x=Software_Platform,y=count Software_Platform,color=none",x desc,none
"A pie chart about what are the different software platforms for devices, and how many devices have each?",original,Pie,Easy,device,device,mark arc data device encoding x software_platform y aggregate count software_platform transform group x,Software_Platform,count Software_Platform,arc,"x=Software_Platform,y=count Software_Platform,color=none",none,none
"Create a bar chart showing how many location across location, and show names from low to high order.",original,Bar,Medium,shop,device,mark bar data shop encoding x location y aggregate count location transform group x sort x asc,Location,count Location,bar,"x=Location,y=count Location,color=none",x asc,none
Return a bar chart showing how many shops in each location.,original,Bar,Easy,shop,device,mark bar data shop encoding x location y aggregate count location transform group x,Location,count Location,bar,"x=Location,y=count Location,color=none",none,none
"Return a histogram on what are the different role codes for users, and how many users have each?, rank by the total number in ascending please.",original,Bar,Medium,users,document_management,mark bar data users encoding x role_code y aggregate count role_code transform group x sort y asc,role_code,count role_code,bar,"x=role_code,y=count role_code,color=none",y asc,none
Find the number of users in each role. Plot them as bar chart.,original,Bar,Easy,users,document_management,mark bar data users encoding x role_code y aggregate count role_code transform group x,role_code,count role_code,bar,"x=role_code,y=count role_code,color=none",none,none
Find the number of users in each role. Visualize by pie chart.,original,Pie,Easy,users,document_management,mark arc data users encoding x role_code y aggregate count role_code transform group x,role_code,count role_code,arc,"x=role_code,y=count role_code,color=none",none,none
"Find the name and access counts of all documents, in alphabetic order of the document name. Show bar chart.",original,Bar,Easy,documents,document_management,mark bar data documents encoding x document_name y aggregate none access_count transform sort x,"document_name,access_count",none,bar,"x=document_name,y=access_count,color=none",x asc,none
Show the relationship between age and weight of the dogs who have been abandoned in a scatter chart.,original,Scatter,Easy,Dogs,dog_kennels,mark point data dogs encoding x age y aggregate none weight transform filter abandoned_yn = 1,"age,weight",none,point,"x=age,y=weight,color=none",none,abandoned_yn = 1
Visualize a bar chart for how much does each charge type costs? List both charge type and amount.,original,Bar,Easy,Charges,dog_kennels,mark bar data charges encoding x charge_type y aggregate none charge_amount,"charge_type,charge_amount",none,bar,"x=charge_type,y=charge_amount,color=none",none,none
Find the number of dorms for each gender in a bar chart.,original,Bar,Easy,dorm,dorm_1,mark bar data dorm encoding x gender y aggregate count gender transform group x,gender,count gender,bar,"x=gender,y=count gender,color=none",none,none
Find the number of dorms for each gender with a pie chart.,original,Pie,Easy,dorm,dorm_1,mark arc data dorm encoding x gender y aggregate count gender transform group x,gender,count gender,arc,"x=gender,y=count gender,color=none",none,none
"List all payment methods and number of payments using each payment methods Plot them as bar chart, display names in ascending order please.",original,Bar,Medium,Customer_Payments,driving_school,mark bar data customer_payments encoding x payment_method_code y aggregate count payment_method_code transform group x sort x asc,payment_method_code,count payment_method_code,bar,"x=payment_method_code,y=count payment_method_code,color=none",x asc,none
List all payment methods and number of payments using each payment methods with a pie chart.,original,Pie,Easy,Customer_Payments,driving_school,mark arc data customer_payments encoding x payment_method_code y aggregate count payment_method_code transform group x,payment_method_code,count payment_method_code,arc,"x=payment_method_code,y=count payment_method_code,color=none",none,none
"What other details can you tell me about students in reverse alphabetical order, and count them by a bar chart",original,Bar,Medium,Students,student_transcripts_tracking,mark bar data students encoding x other_student_details y aggregate count other_student_details transform group x sort x desc,other_student_details,count other_student_details,bar,"x=other_student_details,y=count other_student_details,color=none",x desc,none
"Find the dates of the tests taken with result ""Pass"", and count them by a bar chart, and order by the Y in asc.",original,Bar,Hard,Student_Tests_Taken,e_learning,"mark bar data student_tests_taken encoding x date_test_taken y aggregate count date_test_taken transform filter test_result = ""pass"" group x sort y asc",date_test_taken,count date_test_taken,bar,"x=date_test_taken,y=count date_test_taken,color=none",y asc,"test_result = ""Pass"""
"Find the number of the dates of the tests taken with result ""Pass"".",original,Bar,Medium,Student_Tests_Taken,e_learning,"mark bar data student_tests_taken encoding x date_test_taken y aggregate count date_test_taken transform filter test_result = ""pass"" group x",date_test_taken,count date_test_taken,bar,"x=date_test_taken,y=count date_test_taken,color=none",none,"test_result = ""Pass"""
List each test result and its count in descending order of count by a pie chart.,original,Pie,Medium,Student_Tests_Taken,e_learning,mark arc data student_tests_taken encoding x test_result y aggregate count test_result transform group x sort y desc,test_result,count test_result,arc,"x=test_result,y=count test_result,color=none",y desc,none
"How many completion students in each day? Return a line chart grouping by date of completion, rank by the x axis from low to high.",original,Line,Medium,Student_Course_Enrolment,e_learning,mark line data student_course_enrolment encoding x date_of_completion y aggregate count date_of_completion transform group x sort x asc,date_of_completion,count date_of_completion,line,"x=date_of_completion,y=count date_of_completion,color=none",x asc,none
"Show the county name and population of all counties with a bar chart, I want to sort by the x axis in asc.",original,Bar,Easy,county,election,mark bar data county encoding x county_name y aggregate none population transform sort x asc,"County_name,Population",none,bar,"x=County_name,y=Population,color=none",x asc,none
"How many delegates in each committee? Return a bar chart, and display by the y-axis in descending.",original,Bar,Medium,election,election,mark bar data election encoding x committee y aggregate count committee transform group x sort y desc,Committee,count Committee,bar,"x=Committee,y=count Committee,color=none",y desc,none
List the dates and vote percents of elections in a bar chart.,original,Bar,Easy,election,election_representative,mark bar data election encoding x date y aggregate none vote_percent,"Date,Vote_Percent",none,bar,"x=Date,y=Vote_Percent,color=none",none,none
